Question,Answer
who is on blink 182 album cover,chat
What is the name of the late Major League  old professor,chat
when was the constitution written,chat
what is the use of a sales invoice?,chat
what was the actress who played the pink power ranger,chat
what is squash the sport,chat
where is the world cup in 2010,chat
when was the great fire in chicago,chat
what is hosting a website,chat
when was the first nfl madden game released,chat
what is pci Interface,chat
what is jagger bombs,chat
what is the name of mountains along california,chat
who is the author of tree grows in brooklyn,chat
where is al jazeera based,chat
what is the purpose of child support?,chat
where was martin luther king shot?,chat
who is the mayor of chicago 2011,chat
when is the wv state fair,chat
when was the state of utah established,chat
what is the location of coldwater ms,chat
what is the location of coldwater ms,chat
what is the function of the hard palate,chat
where is Chayanne from?,chat
when is world war hulk movie come,chat
WHERE WAS JOHN WAYNE BORN,chat
what is the difference between alpha lipoic acid and lipoic acid,chat
what is the organic layer in an amoled screen,chat
what is eggnog made of,chat
what is gravy made of,chat
what is gravy made of,chat
what is bourbon made of,chat
what is cta used for,chat
what is vitamin b12 used for,chat
what is vitamin b12 used for,chat
What is the the North American Free Trade Agreement?,chat
what is tmz stand for,chat
what is impingement of the shoulder,chat
where is La Palma africa,chat
where was hillary clinton born,chat
who was the first one to invent medicine,chat
When was 27th amendment proposed,chat
what is singapore's currency,chat
Who was Daniel J Daly?,chat
where was paul revere born,chat
what is the plot of the shawshank redemption?,chat
what is an information technology manager,chat
what is the scientific name of a cardinal bird,chat
where are kenworth trucks built,chat
what is the type of democracy in which all citizens have the right to make  government decisions,chat
when is the feast of St. Rita,chat
where is j.cole from,chat
what is ratchet from ratchet and clank,chat
where was the first real roller coaster,chat
what is in a will,chat
what is the gdp for greenland 2010?,chat
What is hydrogen in,chat
where is UWA on world list of universities,chat
what is bracketing in photography,chat
What is the disk defragmenter tool,chat
what is level of agreement mean,chat
when was purple haze by jimi hendrix made?,chat
where was martin luther born,chat
who is the actor that plays harry potter,chat
"what is the concept of ""wellness"" ?",chat
what is the mortality rate of sepsis,chat
where is kos from?,chat
what is the defensive line in football called,chat
what is the measurements of saturn's moons,chat
what is the @ sign called?,chat
who is the book the catcher in the rye by?,chat
who are the girls from the bad girls club?,chat
what is prince williams last name,chat
what is IBRIX,chat
what is bilirubin total,chat
what was bernie madoff selling,chat
what is quasi judicial agency,chat
who is inventor of the radio,chat
who is the founder of twitter,chat
what is scurvy disease,chat
what is google openid,chat
who is bj's wholesale club,chat
what is atherosclerotic heart disease,chat
what is atherosclerotic heart disease,chat
what is atherosclerotic heart disease,chat
what is atherosclerotic heart disease,chat
what was the name of the uss john kennedy before,chat
what is the name of the wizard of oz,chat
what is the name of the wizard of oz,chat
what were 3 important things that douglas MacArthur did?,chat
what is homebrew for wii,chat
what is homebrew for wii,chat
what is santa's wife's name,chat
when was Saddle Creek founded,chat
what is korean money called,chat
what is three phase electrical,chat
What is the significance of Good Friday?,chat
What is the significance of Good Friday?,chat
What is the significance of Good Friday?,chat
Who is the highest scoring NBA player,chat
where is the great basin located on a us map,chat
what is direct marketing channel,chat
what was the date of pearl harbor,chat
what is disney's magic kingdom,chat
what is the kanji for language,chat
what is in fruitcake,chat
what is the name of the family who own the biltmore estates in nc,chat
who was the congressman who was caught with an escort in ny,chat
where are the kidneys in your body,chat
what is lockton affinity,chat
what is lockton affinity,chat
what is white chocolate made of,chat
what is the latest season of psych,chat
what is the main component of vaccines,chat
what is the name of chris cornell's band?,chat
what is preciosa crystal?,chat
where is the chupacabra found,chat
What is the purpose of North American Free Trade Agreement,chat
who are all of the jonas brothers,chat
what is in the alpine mountain systems,chat
what is in the alpine mountain systems,chat
who is mary matalin married to,chat
where is basque spoken,chat
where is the brisket from,chat
what is human chorionic,chat
where is dear john filmed at,chat
what is busiest airport in US,chat
where is osaka japan,chat
where is osaka japan,chat
what is surname and given name,chat
what is melissa and joey about,chat
What is an economic feature?,chat
What is an economic feature?,chat
What is an economic feature?,chat
what is the average american income,chat
When was Apple Computer founded,chat
what is section eight housing,chat
what is section eight housing,chat