Question,Answer
HOW AFRICAN AMERICANS WERE IMMIGRATED TO THE US,chat
how are glacier caves formed?,chat
how a water pump works,chat
"how big is bmc software in houston, tx",chat
"how big is bmc software in houston, tx",chat
how much is 1 tablespoon of water,chat
how much is 1 tablespoon of water,chat
how much is 1 tablespoon of water,chat
how much are the harry potter movies worth,chat
how a rocket engine works,chat
how old was sue lyon when she made lolita,chat
how are cholera and typhus transmitted and prevented,chat
how did anne frank die,chat
how are aircraft radial engines built,chat
how deep can be drill for deep underwater,chat
how old was monica lewinsky during the affair,chat
how long was frank sinatra famous,chat
how are antibodies used in,chat
how are antibodies used in,chat
how are antibodies used in,chat
how are antibodies used in,chat
how much is jk rowling worth,chat
how big is auburndale florida,chat
"how old is kirk douglas, the actor?",chat
how old is the singer bob seger,chat
how long was i love lucy on the air,chat
how long was richard nixon a president,chat
HOW MUCH IS CENTAVOS IN MEXICO,chat
How long was Mickie James with WWE?,chat
how did armando christian perez become famous,chat
how old were the twin towers when destroyed,chat
how are the # of electrons in each shell determined,chat
how many presidents of the us,chat
how old is beatrice author,chat
how are public schools funded,chat
how are public schools funded,chat
what happens  to the light independent reactions of photosynthesis?,chat
what happens  to the light independent reactions of photosynthesis?,chat
how does interlibrary loan work,chat
how does interlibrary loan work,chat
what did mia hamm do his work,chat
what bacteria grow on macconkey agar,chat
what countries are under the buddhism religion,chat
how did wild bill's father die,chat
how many land rovers have landed on mars,chat
how do forensic auditors examine financial reporting,chat
how do forensic auditors examine financial reporting,chat
how do forensic auditors examine financial reporting,chat
what bird family is the owl,chat
how did harmon killebrew get strong,chat
What did the augurs use to interpret the will of the gods?,chat
How much did Waterboy grossed,chat
"What county is Farmington Hills, MI in?",chat
what does a groundhog look for on groundhog day,chat
What committees are joint committees,chat
how many stripes on the flag,chat
How many states and territories are within India?,chat
how is whooping cough distinguished from similar diseases,chat
how is whooping cough distinguished from similar diseases,chat
what county is galveston in texas,chat
what cities are in the bahamas,chat
what cities are in the bahamas,chat
how many schools are in the big ten,chat
how is single malt scotch made,chat
how is single malt scotch made,chat
what composer used sound mass,chat
what composer used sound mass,chat
what composer used sound mass,chat
what composer used sound mass,chat
what composer used sound mass,chat
what composer used sound mass,chat
what composer used sound mass,chat
How Do You Play Spades,chat
what continent is australia,chat
what causes heart disease,chat
what countries did immigrants come from during the immigration,chat
what countries did immigrants come from during the immigration,chat
how many people live in atlanta georgia,chat
how many people live in atlanta georgia,chat
what does it mean to be a commonwealth state,chat
how long can you be in the supreme court,chat
what county in texas is conroe located in,chat
what can sql 2005 do,chat
how many people were killed in the oklahoma city bombing,chat
What group took home the award for best rock album at the Australian Recording Industry Association (ARIA) Music Awards?,chat
how does a dredge work?,chat
how does a dredge work?,chat
how does a dredge work?,chat
how does a dredge work?,chat
how does a dredge work?,chat
what did benedict arnold die,chat
how many world series did curt schilling have,chat
how many ports are there in networking,chat
what area code is 479,chat
what area code is 479,chat
what does arraignment mean,chat
what did chaucer do,chat
what did chaucer do,chat
what does am and pm stand for,chat
how is canada's health care,chat
how many xbox 360 games are there,chat
how do pineapples grow,chat
what country did wine originate in,chat
how many district are in west bengal,chat
how many towns in new hampshire,chat
what does salesforce.com do?,chat
what does 1 year mean to the planet,chat
what is feedback mechanism in plants during respiration,chat
how fire extinguisher works,chat
what does righteousness mean,chat
what does righteousness mean,chat
what countries are in central america?,chat
how does a steam engine work,chat
how does a steam engine work,chat
what county is tacoma washington in,chat
what county is chula vista ca in,chat
what did isaac newton do,chat
what does the universal law of gravitation state,chat
how does a dim sum restaurant work,chat
how does a dim sum restaurant work,chat
how does a dim sum restaurant work,chat
how many US soldiers killed in Iraq war,chat
how many planets is jupiter away from the sun?,chat
what city was the convention when gerald ford was nominated,chat
how many professional hockey teams in canada,chat
what county is northville mi,chat
what county is northville mi,chat
how many games did brett favre start in a row,chat
what does a vote to table a motion mean?,chat
What does the class mean for SDHC cards?,chat
what do porcupines eat,chat
what did elijah mccoy invent,chat
how many apple store are there in total?,chat
What does the idea of effective nuclear charge tell us,chat
how is jerky made,chat
how is jerky made,chat
what domain is eu,chat
"What does the name ""Meister"" mean in German",chat
what happened on the moon during the period of Late Heavy Bombardment?,chat
How did Edgar Allan Poe die?,chat
what did tycho brahe do,chat
what did tycho brahe do,chat
how many seasons heroes,chat
what holiday is first weekend of september,chat
how old r Dylan and Cole Sprouse,chat
what does life insurance cover?,chat
what does life insurance cover?,chat
what does life insurance cover?,chat
how many days does the chinese new year last,chat
what does s.h.i.e.l.d stand for,chat
how many consoles has xbox 360 sold,chat
how is a backpack made,chat
WHAT COUNTRY IS MEXICO IN,chat
how is slugging percentage calculated,chat
what day is st. patricks day,chat
what cheese is made from goat's milk,chat
what does the federal reserve do,chat
what country is belize in,chat
how many books are included in the protestant Bible?,chat
how many stars on the first american flag,chat
how does a cat purr,chat
what became of rich on price is right,chat
what became of rich on price is right,chat
what county is St. Elizabeth MO in,chat
what county is wilton ca in,chat
what happened to stevie ray vaughan,chat
how many gold gloves does barry larkin have,chat
what caused ww,chat
how did women's role change during the war,chat
how many seasons were there of the wire,chat
what kind of legal remedy is it to ask someone to fulfill there promise,chat
how is ASP.NET different from .NET,chat
how does lsd impact the human body,chat
how does lsd impact the human body,chat
how does lsd impact the human body,chat
how many people live in memphis tennessee,chat
how many muscles in the human body,chat
how did seminole war end,chat
what county is orono maine in,chat
what it is a pilot study,chat
how many humps on a camel,chat
what can be powered by wind,chat
how many nature oceans are on earth,chat
what county is jacksonville florida in,chat
what chili wants wiki,chat
what does a liquid oxygen plant look like,chat
what division is boise state football,chat
"What does the term ""mens rea"" mean",chat
what do UA's detect,chat
how much caffeine is in a shot of espresso,chat
What does Human sperm consist of?,chat
how did the penguins acquire sidney crosby,chat
what does add my two cents mean,chat
how much total wealth in USA,chat
what does a plus-minus sign mean,chat
what does a plus-minus sign mean,chat
how was the moon formed,chat
how was the moon formed,chat
what did ronald reagan do as president,chat
what does judgment as a matter of law mean,chat
how many presidents have been assassinated,chat
what does oklahoma produce,chat
how many redwall books are there,chat
what date did the american civil war start,chat
what does bruce jenner do,chat
what does alkali do to liquids?,chat
what area code is 217,chat
what area code is 217,chat
how jameson irish whiskey is made,chat
what does gloria in excelsis deo mean,chat
how many grams in a troy ounce of gold,chat
how many grams in a troy ounce of gold,chat
How many consecutive games did Ken Jennings win?,chat
"what county is jennings, la",chat
how does nanotechnology affect health,chat
how much does united states spend on health care,chat
what does it take to start a lodge in freemason,chat
how does black pepper grow,chat
how south african leaders are elected,chat
how was the phone invented,chat
how many died in hiroshima and nagasaki,chat
what county is Holly Ridge nc in?,chat
what forms seasons,chat
what forms seasons,chat
what forms seasons,chat
how did mohammed gandhi die,chat
how many users do twitter have,chat
what kind of books does debbie macomber writes,chat
what county is catonsville md in,chat
what kind of literature did john steinbeck writing,chat
whatever happened clint walker,chat
what does the family leave act,chat
what does the family leave act,chat
how did the vietnam war end,chat
How is the pothole formed,chat
how much more time does chemo give to people with renal cancer,chat
what does estee lauder do,chat
how does a solid state drive work,chat
how does a solid state drive work,chat
how long did the roman empire last,chat
how much does U.S. pay on health care per person,chat
what creates sonic boom,chat
how is rfid tag powered,chat
how is rfid tag powered,chat
how is rfid tag powered,chat
what city is oregon state university in,chat
how long have kanab ambersnail been endangered?,chat
how many spanish speaking people are there in the us,chat
what does (sic) mean?,chat
how does sedimentary rock form,chat
how many bones are in the skeletal system is composed of 306 bones,chat
what did st.patrick do,chat
how do you know if something is the golden ratio,chat
What county is NOrth Myrtle Beach in SC,chat
how much of our universe does plasma make up,chat
How is a computer used?,chat
what does barefoot and pregnant mean,chat
"what county is oakhurst, nj in",chat
What did Lawrence Joshua Chamberlain do?,chat
what circuit court is maryland,chat
what causes a deficiency in adenosine deaminase,chat
how often does ham station need to ID?,chat
how is human height measured,chat
how many days are in a leap year,chat
what does a timing belt do,chat
what county is bethlehem pa in,chat
what countries legalize marijuana,chat
how many albums has dmx sold to this date,chat
what channel is shopnbc on,chat
how post and lintels are used,chat
what do mucous membranes secrete,chat
what company is cricket wireless by,chat
how many numbers on a credit card,chat
what county is Cambria WI in,chat
how is public policy created,chat
how many wives did henry the 8th have,chat
what country are bongo drums from?,chat
how many books in bible,chat
HOW MANY STRIPES ARE ON THE AMERICAN FLAG,chat
HOW MANY STRIPES ARE ON THE AMERICAN FLAG,chat
what do biologists do,chat
what does base jumping stand for,chat
what does base jumping stand for,chat
What country is the largest stalagmite,chat
what does Gringo mean,chat
what does Gringo mean,chat
what does hair testing show,chat
what does freedom of speech cover,chat
what hormones produce thyroid,chat
what does automatic paper feeder on printers mean,chat
what county is san jose in?,chat
what cars have smart key systems,chat
how old a child pedophile crime,chat
how many people were killed in the holocaust,chat
how did John F. Kennedy die?,chat
how many members are in the house of representatives,chat
what can silk be used for,chat
what channel is letterman on,chat
what does uncle sam represent to the american people,chat
what does karma mean in buddhism,chat
what does karma mean in buddhism,chat
what does karma mean in buddhism,chat
what do cyberstalkers do,chat
how do insulin syringes work,chat
what kind a is tilapia,chat
how did david carradine die,chat
how many grape farms in united states,chat
what freezes faster? hot or cold water?,chat
what causes a small bowel obstruction,chat
how many qfc stores are there,chat
what affects the money supply,chat
how is today special?,chat
What Causes Brain Freeze,chat
what does auld lang syne mean,chat
what does leeroy jenkins mean,chat
how was the president involved in the gulf war,chat
how many times has a player hit for the cycle,chat
how many times has a player hit for the cycle,chat
how many episodes of Lost were there,chat
what does it mean if i'm flat footed?,chat
what age group is generation x,chat
how did James Dean die?,chat
what glows in the dark,chat
what did sparta do around 650 bc,chat
what fantasy american football means,chat
how many muscles in the body,chat
how many muscles in the body,chat
how much does a gold bar weigh,chat
how much does a gold bar weigh,chat
what county is bolingbrook il in?,chat
how many kids does archie manning have,chat
what does an advocacy website promote?,chat
what does the green mean on the mexican flag,chat
how often do elk have sex,chat
how many amendments in us,chat
what city is george washington university,chat
How many Muslims live in the United Kingdom?,chat
How many Muslims live in the United Kingdom?,chat
how many players on a side for a football game,chat
what does the temporal lobe part of the brain do,chat
how many lungs does a human have,chat
how long to take iwo jima,chat
What a Margarita contains,chat
what color is burgundy,chat
what color is burgundy,chat
what is the population of center tx,chat
what causes photo red eye,chat
what creates a cloud,chat
how many students go to santa barbara,chat
what day is the feast of st joseph's?,chat
what culture is mariah carey,chat
how was color introduced in film?,chat
how was color introduced in film?,chat
what artist have song with ashanti?,chat
what came first army or air force,chat
what day is 2011 super bowl?,chat
what does the FOIA apply to,chat
how many countries are member of the eu?,chat
how many vehicles are registered in the us,chat
what does a laboratory in a gynecologist office consist of,chat
what cards do you need in poker to get a royal flush,chat
what does xylem transport,chat
how many mvps has kobe bryant won,chat
what do jehovah witnesses believe,chat
what do jehovah witnesses believe,chat
how old old is xp operating system,chat
how many pawns in chess,chat
what countries allow gays to openly serve in the military,chat
How Works Diaphragm Pump,chat
how is hydrogen produced,chat
how many percent is a basis point,chat
how many percent is a basis point,chat
how many percent is a basis point,chat
what genre is bloody beetroots,chat
what country is madrid spain in,chat
What causes rogue waves,chat
what happened to montgomery clift,chat
how many asian indians live in usa,chat
what caused the world war 2,chat
what caused the world war 2,chat
what happened to george o'malley on grey's anatomy?,chat
what happened to george o'malley on grey's anatomy?,chat
what happened to george o'malley on grey's anatomy?,chat
what happened to george o'malley on grey's anatomy?,chat
how many people die from myasthenia gravis per year,chat
how many rooms in borgata hotel,chat
what country has the most muslims in the world,chat
what country is dubai in,chat
how much of earth is covered ocean water,chat
how is root beer made?,chat
how much did yankee stadium cost,chat
what does informal logic mean,chat
what country is turkey in,chat
what country is turkey in,chat
"what county is Augusta,GA located in?",chat
"What happened to ""The Glades"" tv series",chat
how many albums has eminem sold in his career,chat
what do pigs eat,chat
what does a cutter do,chat
what it takes aerosmith album,chat
what it takes aerosmith album,chat
what county is erie colorado,chat
What happened during the Starving Time in Jamestown?,chat
What happened during the Starving Time in Jamestown?,chat
What happened during the Starving Time in Jamestown?,chat
what classes are considered humanities,chat
what classes are considered humanities,chat
what classes are considered humanities,chat
what classes are considered humanities,chat
what does the president of the usa do,chat
what does the president of the usa do,chat
what does the president of the usa do,chat
what food is in afghan,chat
what food is in afghan,chat
how kimberlite pipes form,chat
how many seasons of grey's anatomy are there,chat
how is schizophrenia diagnosed?,chat
what kind of cut is tri tip,chat
what kind of cut is tri tip,chat
what county is willmar mn in?,chat
what kind of company is Microsoft?,chat
how does weather happen,chat
how many countries have english as an official language,chat
what countries are in cono sur,chat
what countries are in cono sur,chat
how many innings makes an official game,chat
what branch of the military is delta force,chat
what causes the seasons,chat
what does 3g network mean,chat
what does Mazel tov! mean,chat
How Do You Get Hepatitis C,chat
how does flexible spending account work,chat
how tennessee became a state,chat
how many baseball teams usa,chat
what county is coatesville indiana located in,chat
how does Delaware support its claim to being the first state?,chat
how many amendments in the US constitution,chat
what does fidelity do,chat
what causes thunder sound,chat
what causes thunder sound,chat
what day is the federal holiday for Martin Luther King Jr.,chat
what area code is 949,chat
what does continuous improvement mean,chat
what area code is 810,chat
how many babies are in a typical raccoon litter,chat
what kind of earthquake was haiti,chat
what kind of horse was mr ed,chat
What does Rapture meaning in a theological sense?,chat
who does chris humphries play for,chat
what are corporation balance,chat
what is .17 hmr caliber,chat
what made the civil war different from others,chat
where to buy potato bread made without wheat,chat
what year was the 8 track invented,chat
what are points on a mortgage,chat
who killed julius caesar,chat
what are  the  official languages of nigeria,chat
"who played guitar on the kiss album, creatures of the night",chat
who wrote white christmas,chat
what are the different types of cross country skiing,chat
what are use taxes?,chat
what are use taxes?,chat
what are use taxes?,chat
WHAT IS A FY QUARTER,chat
who pulmonary hypertension,chat
what is an array in programming,chat
what is an array in programming,chat
who wrote a rose is a rose is a rose,chat
what is a notary for,chat
what is a notary for,chat
when did the cold war start,chat
what state is pike's peak in?,chat
what state is jakarta in?,chat
what song is sung in 6 foot 7 foot,chat
what is a book index,chat
who sings the song never ending story,chat
who can file suspicious activity report,chat
who created facebook,chat
what are the sulfas,chat
what are risk for infections,chat
who owns joe's crab shack,chat
where do cruises dock in new york city,chat
what is a right wing christian,chat
who played the lead roles in the movie leaving las vegas,chat
what is a CMM machine,chat
what percentage of water in in the body,chat
what percentage of water in in the body,chat
what type of batteries are 357 (LR44),chat
where did hurricane katrina begin,chat
where did hurricane katrina begin,chat
what is an assist in basketball,chat
what is 1 mil guaranies in united states dollars,chat
where did the persian war take place,chat
where did the persian war take place,chat
where did the persian war take place,chat
where did the persian war take place,chat
where did the persian war take place,chat
where did the persian war take place,chat
where did the persian war take place,chat
what is a day care for?,chat
who discovered neptune the planet,chat
what separates me from you album,chat
when did thomson make the plum-pudding model,chat
what part of the pig is bacon,chat
where did erisa come from,chat
where did erisa come from,chat
what percent of illegal immigrants are from mexico and europe,chat
what school district is alvin in?,chat
what are the houses of hogwarts,chat
when us subprime mortgage market collapse,chat
What kind of personality test is the MBTI,chat
What kind of personality test is the MBTI,chat
What kind of personality test is the MBTI,chat
what type of game is heavy rain,chat
what are superannuation contributions?,chat
where does a flea live,chat
what is a group of deer called,chat
what state was john mccain a senator in during the 2008 election,chat
when does the electoral college votes,chat
when barack obama was born,chat
who wrote rhythm of the ancient mariner,chat
when did freddie mercury die,chat
what is a .PAC file,chat
what is a .PAC file,chat
what are spoilers for,chat
who sings i am a man of constant sorrow,chat
who kill franz ferdinand ww1,chat
what year did disney's animal kingdom lodge open,chat
what are two languages in Nigeria?,chat
what war led to Pearl Harbor,chat
what is a mms message,chat
where in the world are smallpox common,chat
what year did the beatles came out with the song i wanna hold your hand,chat
what year did the beatles came out with the song i wanna hold your hand,chat
what is a gasser car,chat
what tensions preceded the berlin blockade,chat
who sang proud mary,chat
who sang that song-a change is going to come,chat
where do crocodiles live,chat
what percentage of the human body is water,chat
what relates to erosion,chat
what relates to erosion,chat
what is a form of legal ownership,chat
where in oregon is albany,chat
where in oregon is albany,chat
who wrote what's my name rihanna,chat
what year did isaac newton die,chat
what is a constant in math?,chat
when did abraham lincoln write the emancipation proclamation??,chat
what part of the pre-world war 1 arms race was the most intense?,chat
who owns land rover,chat
what states have legalized prostitution,chat
what states are on the east coast,chat
when president nixon resigns,chat
when did sertraline come on the market,chat
where fourth of july came from,chat
when did secretariat win,chat
what are batteries made up of,chat
what are batteries made up of,chat
what is a full job time??,chat
what are the three primary colors in the subtractive color model,chat
what are layers of the ionosphere,chat
what people used mayan numeral system,chat
what is a newsgroup message,chat
who plays as big bird,chat
who plays as big bird,chat
who accompanied King louis the VII of France on the second crusade,chat
who founded walmart,chat
what are some legal uses of meth,chat
when did gary moore die,chat
what is 6 pin din connector,chat
what is a hosting company on a website,chat
Where does the word baptism come from,chat
what school did Zach Thomas play for before making it in to the NFL,chat
what order is the moth,chat
what are the uses for gui,chat
who won antm cycle 12,chat
who owns exxon mobil,chat
who built the globe,chat
what are warehouse spreadsheets used for,chat
what are warehouse spreadsheets used for,chat
what are warehouse spreadsheets used for,chat
what is a rock quarry,chat
what kind of school is MIT,chat
Who Started the Mormon Church,chat
what are banana plugs for,chat
what part of the earth's structure is believed to consist of tectonic plates,chat
when did the trojan war take place,chat
what is a letterbox movie,chat
what is a letterbox movie,chat
who won the 2009 super bowl,chat
what is a popular people meter,chat
what are the characteristics of bryophytes,chat
when to use semicolon,chat
when did xbox release,chat
what is a roll play games,chat
when did the civil war start and where,chat
What are the busiest airports in the world,chat
where the streets have no name filming location,chat
where did the mayflower land,chat
what is a forward in soccer,chat
WHO QUALIFIES AS A DOMESTIC PARTNER IN CA,chat
where did mark jackson play pro basketball?,chat
what languages are spoken in south africa,chat
what languages are spoken in south africa,chat
Who controlled Alaska before US?,chat
what are stink bombs made of,chat
what are stink bombs made of,chat
who sang black velvet,chat
"who said ""A picture is worth a thousand words""?",chat
who produced loyal to the game?,chat
WHAT ARE HERITABLE TRAITS,chat
who does afge represent,chat
what teams won super bowl,chat
what year was christianity introduced to sub-saharan africa,chat
who wrote puff the magic dragon,chat
when did expos become nationals,chat
what is a contingent fee with an attorney,chat
what is a D.O. stand for medical doctor,chat
what is a vetting process,chat
when did the free soilers party start?,chat
who reports the consumer price index,chat
"where does the expression ""knocking on wood"" come from",chat
what are rocker arms?,chat
who sang the nights the lights went out,chat
who sang the nights the lights went out,chat
where does the return address go on mail,chat
where does the return address go on mail,chat
when did steven adler play for guns and roses,chat
what is a synthetic conduit,chat
what is a wwII theater,chat
what is amoxicillin for?,chat
what state was the civil war in,chat
where did the early humans live?,chat
where did the early humans live?,chat
who invaded north africa during ww2,chat
WHAT YEARS WAS THE C5 VETTE PRODUCED,chat
what year was gulf war,chat
What U.S. President's head has been featured on the nickel (five-cent coin) since 1938?,chat
who sings stand by me,chat
When did F15s first fly,chat
what year was elvis born,chat
what are the arb medications,chat
where did columbus really land in 1492?,chat
what is a brindle boxer,chat
what are SATA Power Connector,chat
what are SATA Power Connector,chat
who invented the internet,chat
"What kind of poem is ""This is Just to Say""",chat
when does the royal standard fly?,chat
