Question,Answer
when does the royal standard fly?,chat
who played dumbledore in harry potter,chat
who played dumbledore in harry potter,chat
what produces calcitonin,chat
who hit the first home run at riverfront stadium?,chat
Who Makes Nexen Tires,chat
who did richard nixon refer to as the  silent majority,chat
who did richard nixon refer to as the  silent majority,chat
what the atmosphere on mercury,chat
What are the lateral and median apertures of the brain?,chat
what year did the last monkeys go into space,chat
what part of the pig do pork chops come from,chat
what are grits made from,chat
what religion is westminster abbey,chat
when did coca cola first come out,chat
what role do ombudsman play in the swedish government?,chat
what state is new england in,chat
who played batman in dark knight,chat
what are stanzas in poetry,chat
what are stanzas in poetry,chat
who shot franz ferdinand,chat
who won the super in xl1,chat
what are the three ossicles,chat
what are the parts of plant stems?,chat
what is an army specialist,chat
what year did martin luther king die,chat
what to make with linen,chat
what spanish speaking countries have the most world cup titles,chat
who composed the Singapore national anthem,chat
what south dakota county is wakonda in,chat
what are american people of japanese descent called,chat
what are american people of japanese descent called,chat
when does v start,chat
when did spongebob first air,chat
what are d.o. of medicine,chat
what are d.o. of medicine,chat
what is a bus adapter in a computer?,chat
where does cashmere come from,chat
Who invented egg rolls,chat
what westerners include in pain and suffering,chat
what westerners include in pain and suffering,chat
what is a medallion guarantee,chat
what is a medallion guarantee,chat
who won the 2010 world cup,chat
who wrote the song in the mood,chat
what is active learning strategies,chat
"what is ""thin film"" technology",chat
who sang I want to dance with somebody,chat
what zones are tropical,chat
what type of business is walmart,chat
what part of the plant are avocados,chat
when does air bag deploy,chat
what are some chinese inventions,chat
what are some chinese inventions,chat
who sung the banana boat song,chat
when did wwi begin,chat
what year did keeping up with the kardashians begin,chat
what two empires fought to control afghanistan,chat
what triggered the civil war,chat
what is a store confectioner,chat
what is a store confectioner,chat
when did qing dynasty begin,chat
who owns youtube,chat
what are tires made of,chat
who killed general warren in bunker hill,chat
where do women ejeculation exactly coming from,chat
who won the women's world cup,chat
when did texas become a state,chat
who owns smirnoff,chat
who made the matrix,chat
what are some six sigma tools used,chat
who wrote serenity prayer,chat
what are the Declaration and Resolves of the First Continental Congress about,chat
what are the Declaration and Resolves of the First Continental Congress about,chat
what are the Declaration and Resolves of the First Continental Congress about,chat
what is a bad beat in poker,chat
what part of beef are rouladen cut from?,chat
where does cellular respiration occur,chat
who created massey ferguson,chat
what is a lapping machine,chat
who plays ethan in my babysitter's a vampire,chat
where do the mohawks live,chat
where do the mohawks live,chat
where do the mohawks live,chat
when did proof die,chat
when did proof die,chat
what is a base SI unit,chat
when did ww1 end?,chat
what state is area code 419,chat
what is 9/11 bombings,chat
what are social security taxes,chat
what town is laurel hollow ny in,chat
when did charles dickens live,chat
when did the civil rights movement begin,chat
who won fifa world cup 2010,chat
when did egg mcmuffin get invented,chat
who shot john lennon?,chat
what state is new orleans in,chat
what where the most important factors that led to the defeat of the democrates in 1968?,chat
when did kurt cobain kill himself,chat
who starred in the original true grit,chat
what is a millwright worker,chat
what the names of destiny's child,chat
who created the tourbillon movement?,chat
what is an .msi file,chat
what year did mexico gain independence from spain,chat
What are procedure codes terms in coding?,chat
what is a Four Lokos,chat
what is a fret on a guitar,chat
what year was smokey the bear invented,chat
who said tv is a vast wasteland,chat
what is a duvet cover used for,chat
who did mr bojangles,chat
what is an agents job role in film,chat
what is an agents job role in film,chat
"who discovered the 2 moons of mars,Phobos and Deimos",chat
WHAT IS A LAW ENFORCEMENT MURDER BOOK,chat
where does angela davis currently work,chat
when album love always released,chat
who wrote west side story,chat
who killed robert kennedy,chat
when Harry met Sally case,chat
who owns hamburger helper,chat
what makes a dwarf planet,chat
what makes a dwarf planet,chat
when did jack lalanne die,chat
who made the original care bears,chat
what states does interstate 70 travel through,chat
when do solar eclipses happen?,chat
where do mangos come from,chat
what latitude is tropic of cancer,chat
what video format will play in a DVD player,chat
what part of the government governs the US post office?,chat
what state is the capital in,chat
what are square diamonds called?,chat
what motor does a 2001 monte carlo,chat
where scottsdale?,chat
who has brad pitt dated,chat
what is a dogs classification,chat
what year was President kennedy president?,chat
who owns popeyes chicken,chat
what nationality is wendy williams,chat
who said give me liberty or give me death,chat
who said give me liberty or give me death,chat
what president was theodore roosevelt,chat
who starred in webster,chat
what are the most known sports in america,chat
what are the most known sports in america,chat
what is a monarch to a monarchy,chat
"what is an ""N.M?",chat
what is adem disease,chat
what is adem disease,chat
what year did john adams become  president?,chat
who created bing,chat
who made hubble telescope,chat
what are anti inflammatories,chat
who sang momma told me not to come,chat
when did andrea doria sink,chat
what are dialysis tubes,chat
who designed the statue of liberty,chat
what is am 2201,chat
who wrote second corinthians,chat
who first synthesized heroin,chat
when did george washington died?,chat
when did george washington died?,chat
what is a wiki platform,chat
what are four thirds cameras,chat
who plays dumbledore in harry potter 6,chat
what type of land is savannah,chat
who wrote  nature boy,chat
who set the world record for women for high jump,chat
when did playstation 3 first launch,chat
where does ground pepper come from,chat
where does ground pepper come from,chat
where does ground pepper come from,chat
what type of ecosystem does stingrays live in,chat
who wrote the song cocaine,chat
when did pearl harbor get bombed,chat
what religion is primary in africa?,chat
who won season 2 of project runway,chat
when did marlins start,chat
what is a mule in coins,chat
where do dungeness crab live,chat
who plays mary poppins in the movie,chat
what is an arc in a story plot,chat
What are the different translations for the Bible,chat
What are the different translations for the Bible,chat
when does black friday start for christmas,chat
when does black friday start for christmas,chat
when does black friday start for christmas,chat
who sang what a wonderful world,chat
what month is the president inaugurated,chat
when did Emperor Justinian die,chat
what movement was elizabeth cady stanton a part of,chat
what movement was elizabeth cady stanton a part of,chat
what radio station are the boston bruins on?,chat
what radio station are the boston bruins on?,chat
when did ms .drgs go into effect,chat
what are the characteristics of an ethnic group,chat
what are the characteristics of an ethnic group,chat
what are the characteristics of an ethnic group,chat
what mountains are on appalachian trail,chat
what are add ons,chat
what are add ons,chat
what are add ons,chat
what are add ons,chat
what are add ons,chat
what are add ons,chat
what would be the deliverables,chat
what are club seats,chat
what are club seats,chat
what school did oprah winfrey help,chat
when did scott pilgrim come out,chat
what is a google in math,chat
what structure is disulfide bonds,chat
what is a redshirt freshman football player,chat
who rules communism government,chat
who makes skittles?,chat
what year did South Africa become a team in rugby,chat
what is a discipline of study,chat
what is a discipline of study,chat
who did john f kennedy run against?,chat
who wrote stand by me,chat
what are metaphors used for,chat
what are metaphors used for,chat
what season is  dexter on,chat
What are context effects of memory?,chat
what are the names of the ll divos,chat
who won the 1998 world cup,chat
where did the vietnamese settle in america,chat
What is a 28 day cycle?,chat
when did hitler kill himself,chat
when did world war 2 end,chat
what is a llc company?,chat
what is a llc company?,chat
what are k cups,chat
what is a chronograph watch,chat
what is a PCI port used for,chat
who won the 1967 nba championship,chat
who make airbus,chat
who invented the television,chat
what are the side effects for lyme disease,chat
what are the side effects for lyme disease,chat
when did the movie deep blue sea come out,chat
when did the movie deep blue sea come out,chat
who wrote the song for star wars,chat
what are a and r reps,chat
what measurement is a furlong,chat
where does ray lamontagne live,chat
when the wind blows james patterson,chat
who made facebook,chat
what are the catholic gifts of the holy spirit,chat
what are the catholic gifts of the holy spirit,chat
where do you find iodine,chat
what are lobbying groups,chat
what are lobbying groups,chat
what kind of people are on the show skins,chat
who played the drums in the band cream back in 1968,chat
what president made decision to buy louisiana,chat
who sang cool jerk,chat
what is a league in the sea,chat
what nationality is kris jenner,chat
when will ie9 be released,chat
when did classification of races begin,chat
when did lucy stone died,chat
what are stocks and bonds,chat
what are stocks and bonds,chat
what are the boundaries of the pelvic outlet,chat
what states has the electric chair,chat
what are private labels,chat
when did germans enter paris in ww2,chat
who wrote the song feelin alright,chat
what is a neuro tract,chat
when did dr.carter g woodson die,chat
what are loan originations,chat
what are loan originations,chat
When did the New Deal start,chat
what year did aerosmith i dont want to miss a thing,chat
when did daylight savings time start,chat
What region of France is Montargis in?,chat
what year lord of rings made?,chat
what time will the world end on may 21,chat
what is  file based system,chat
who makes triumph motorcycles,chat
who makes triumph motorcycles,chat
What political conflicts marked the presidency of William Howard Taft?,chat
what temperature is a salt ice bath,chat
when slavery abolished,chat
when slavery abolished,chat
what produces primary xylem?,chat
what is a ti 82?,chat
what is a ti 82?,chat
what makes of the united states,chat
what makes of the united states,chat
what makes of the united states,chat
what makes of the united states,chat
what are circumpolar constellations,chat
where do sesame seeds come from,chat
who owned kansas before it became a state,chat
where did the olmecs come from,chat
what states allow same sex marriage,chat
when did thomas jefferson become president,chat
when did thomas jefferson become president,chat
who sang sun city,chat
who won the most nba championships,chat
when did the word fuck begin,chat
what are the 7 continents,chat
what state is milwaukee in,chat
who wrote the song hallelujah,chat
what are garnishments,chat
what years was the 18th century,chat
what year was the eiffel tower made,chat
when monopoly came out,chat
what are land parcels,chat
what state is Mn,chat
what naturally occurring isotopes does cobalt have,chat
Who Moved My Cheese Synopsis,chat
who replaced nikita khrushchev,chat
What Are Mnemonic Devices,chat
who passed no child left behind,chat
what are the charges against Casey Anthony,chat
What is a surveyors wheel,chat
where did world war 1 start,chat
what species is a spider,chat
what year was girls just want to have fun release,chat
when can you use a defibulator,chat
who created the cato institute,chat
what are the players in Quidditch?,chat
who wrote the song a little more country than that>,chat
who makes blackberry,chat
when does a demand curve shift?,chat
what are arizona's symbols,chat
what are arizona's symbols,chat
what is adoration catholic church,chat
when the body is systemic,chat
what are SLR cameras,chat
what is a vm server,chat
Where Elephants Live,chat
what are the quad muscles,chat
when did the titanic sink,chat
where is the human thigh located?,chat
what is considered a large car,chat
who is flo from progressive,chat
who is flo from progressive,chat
who is flo from progressive,chat
who is flo from progressive,chat
when was james madison in the house of representatives,chat
What is and where is hydraulic fluid found and used for,chat
Where Are Mahindra Tractors Made,chat
Where Are Mahindra Tractors Made,chat
what is petit lemans,chat
what is middle class in the us,chat
what is middle class in the us,chat
what is middle class in the us,chat
what is the scientific name of the eastern tiger salamander?,chat
what is considered to be a disasters,chat
What is firebird server,chat
What is firebird server,chat
What is caused by the human immunodeficiency virus?,chat
what was the steelworkers strike,chat
When was the first Mary Poppins book written,chat
what is sims language,chat
what is the function of the vas deferens?,chat
What is Ischemia or infarction?,chat
What is Ischemia or infarction?,chat
What is Ischemia or infarction?,chat
where is humboldt ks,chat
what was nixon accused of,chat
what was nixon accused of,chat
who is elizabeth from general hospital who are the boys fathers,chat
what is reagan known for,chat
what is reagan known for,chat
what is reagan known for,chat
what is evoked otoacoustic emissions,chat
what is chep pallet,chat
who is victoria jackson from saturday night live,chat
what was the post modernist era in literature?,chat
who is the group enigma,chat
who is the group enigma,chat
when was scooby doo created,chat
what is the federal death tax,chat
when was raphael born,chat
who is the CEO OF FACEBOOK,chat
What Is the Largest Whale,chat
What Is Range in Math,chat
where is the seed located in an artichoke,chat
who is on the hundred dollar bill,chat
what is the ingredient in mustard,chat
who are the members of the climax blues band?,chat
when was the web invented,chat
WHAT IS PARESTHESIAS OF HANDS,chat
WHAT IS PARESTHESIAS OF HANDS,chat
what is kathmandu known for,chat
where is mark sanchez from,chat
who is paul avery to the zodiac killings,chat
what is sump pump  used for,chat
when was bloody kansas in,chat
What Is Benzene Used For,chat
what is homebrew for wii?,chat
where is cougar town filmed,chat
who was bush's national security advisor,chat
who was bush's national security advisor,chat
what is another name for the large intestine,chat
where is green bay packers from,chat
where is the valley at in los angeles,chat
when was the world of coca cola built,chat
when is susan smith eligible for parole,chat
what is the highest mountain in america and where is is located?,chat
what was the first honda car,chat
what was the first honda car,chat
when was everybody hates chris made,chat
what is lung effusion,chat
what is the population of san francisco,chat
who is the writer of the beowulf poem?,chat
who is shem in the bible,chat
who is shem in the bible,chat
what is go daddy.com?,chat
where is andy whitfield from?,chat
where is the country andorra located,chat
what is the highest point in oahu,chat
what is spelt flour,chat
what is spelt flour,chat
what is sherlock holmes job,chat
what is sherlock holmes job,chat
where is kennywood in pittsburgh,chat
what is social security card used for,chat
what is the minimalist trend,chat
Who is the rap singer in right round with kesha in the background? *(dancer)*,chat
who is the current Chief Justice of the U.S. supreme court?,chat
what is rock of ages about,chat
when was the american labor union formed,chat
what is the largest credit union,chat
what is the singer Stevie Wonders full name,chat
what is definition of psychotic,chat
Who is General Grievous of Star Wars,chat
where is scotty mccreery from,chat
what is general chu chicken,chat
where is david ortiz from,chat
what is an irregular heartbeat pvc,chat
what is an irregular heartbeat pvc,chat
what is flour made from,chat
what is my resting heart rate at age 24,chat
what is the name for an old horse-drawn vehicle,chat
where was the tsunami in 2005,chat
what is the source of geothermal energy,chat
what is cubic ft,chat
when was kirstie alley on cheers,chat
who was ho chi minh in vietnam war,chat
what is another name for cpu,chat
who was charged with murder after the massacre at My lai,chat
what was the city of Mithridates,chat
what is metal music about,chat
what is metal music about,chat
what is extreme right wing,chat
what is extreme right wing,chat
what is the title of Hobbes main work,chat
what is high emotional intelligence?,chat
what is the role of heredity,chat
what is the role of heredity,chat
what is prefix phone number,chat
what is metformin used for,chat
what is metformin used for,chat
what is the cabin pressure of us airlines,chat
what is the cabin pressure of us airlines,chat
what is it like at mount rushmore?,chat
what is buttoned-down shirt?,chat
when is administrative assistant day,chat
where is keith whitley from,chat
who is basketball star antoine walker,chat
where are the internal and external iliac arteries,chat
what is steam by valve corporation,chat
where is the Rhine river located on a map,chat
what is sanskrit shri,chat
what is civil engineering aBOUT,chat
WHere is a famous alluvial plain,chat
Where is South Beach in Miami,chat
who was john f kennedy up against,chat
what is the controlled substance act known as,chat
what is the si unit of pressure,chat
what is the great basin area,chat
when was fdr elected as president,chat
where was ms-13 originally from,chat
what is bones job,chat
where was the super bowl in 1991,chat
when was malcolm x assassinated,chat
when was malcolm x assassinated,chat
who are the characters in 90210 in season 3,chat
when was queen elizabeth ii married,chat
where is penn state stadium,chat
what is in a tequila sunrise?,chat
where are facial sinuses,chat
what is lean manufacturing and who developed,chat
what is lean manufacturing and who developed,chat
who is is the singer westlife,chat
what is vitamin a for,chat
what is vitamin a for,chat
what is the capital city of california.,chat
when is it memorial day,chat
"What was ""Freedom Summer""?",chat
"What was ""Freedom Summer""?",chat
what is the function of the liver,chat
what is the function of the liver,chat
what is the formula for calcium nitrate,chat
where is dia de los muertos celebrated,chat
where is the 2011 mlb all star game location,chat
what was the Name the first electronic handheld calculator,chat
when was washington elected president,chat
where is the island New Guinea?,chat
what is in milk,chat
what is in milk,chat
What is motorcycle speedway racing,chat
what is customary at shiva,chat
what is customary at shiva,chat
what is customary at shiva,chat
who is the guy in the wheelchair who is smart,chat
what is in a hot toddy,chat
what is honey bee propolis,chat
what is honey bee propolis,chat
when was steven tyler born,chat
what is name of national anthem song of switzerland,chat
what is blood urea,chat
what is blood urea,chat
where are the most concentration of jews living,chat
what is corpus christi holiday,chat
who was the first european in the americas,chat
where is testosterone produced,chat
where is testosterone produced,chat
where is testosterone produced,chat
what is the difference between multistage and cluster sampling,chat
where is jamestown north carolina,chat
what is cu the element,chat
what was the parthenon used for,chat
what is stepwise linear regression,chat
when was jamestown colonized,chat
what was the first year of kentucky derby,chat
who is on the $10. bill,chat
when was andy griffith born,chat
what is the definition of a hung jury,chat
who is norah jones parents,chat
what is the capacity of the cowboy stadium,chat
what is the capacity of the cowboy stadium,chat
what is Carbon 14 dating is a type of ?,chat
what is the color puce,chat
when was the battle at tombstone fought,chat
where was jfk buried,chat
what is the population of algoma wi for 2010,chat
what is renaissance english,chat
Who is the husband of Betty Ford,chat
what was Coco Chanel's real first name?,chat
what is grist mill stone,chat
who is Dr. JB Danquah,chat
where is big pokey from,chat
what is baklava recipe,chat
what is the rule of the 9s,chat
where  is kj 52 from,chat
what is the sign for degrees,chat
what is the sign for degrees,chat
what is the prognosis of stomach cancer,chat
who is carlos pena on big time rush,chat
what is el mate,chat
what is dave batista doing now,chat
WHO IS HENRY SAMPSON JR.,chat
where is the arctic circle located on the earth,chat
what is the erb/heart,chat
when was pokemon first started,chat
where are colors on stoplight,chat
where are colors on stoplight,chat
where are colors on stoplight,chat
where are colors on stoplight,chat
what is the fundamental theorem of calculus used for,chat
what is the fundamental theorem of calculus used for,chat
what is nicki minaj real name,chat
what is the disease osteonecrosis of the jaw?,chat
what is the disease osteonecrosis of the jaw?,chat
what is mincemeat made of,chat
who is suicide tna,chat
where is hickory located nc,chat
what is Polyester in packaging PET,chat
what was the GE building in rockefeller plaza called before.,chat
who are the two senators of louisiana,chat
who is director jack smight,chat
what is dmitri mendeleev 4,chat
what is dmitri mendeleev 4,chat
where is modesto california,chat
what is the female symbol called,chat
who is st patty?,chat
what is leasehold; real estate,chat
when was Mary Anderson born,chat
WHO WAS IN THE MOVIE I CONFESS WITH MONTGOMERY CLIFT,chat
WHAT IS THE LENGTH OF A NAUTICAL MILE,chat
what is black hairy tongue disease,chat
what is firewire used for,chat
when was srv born,chat
what is stent surgery,chat
what is ethernet gigabit,chat
where is the tibia location,chat
what is tofu made of,chat
Where is Bubbles the Chimp now,chat
what is muse's lead singer's name,chat
where is bloemfontein in africa,chat
What is the prostate for?,chat
what is in the preamble of the constitution,chat
when was the internet started,chat
where is rolling rock brewed,chat
when was Pope Benedict XVI elected?,chat
Who was John Adam's children,chat
who was on the 10 dollar bill,chat
what is water jet propulsion,chat
where is the sermon on the mount in the bible,chat
who is E from entourage,chat
what is article 5 about,chat
what is the political tea party,chat
what is puerto rico currency,chat
What is the function of albumin?,chat
who is ezekiel in the bible,chat
where are the ten commandments in the bible,chat
what is endodontic dentistry,chat
who is the junior senator of nc,chat
who is heisman trophy named after,chat
what is sado masochism,chat
where are Giant Panda Bears found?,chat
where is loxahatchee fl at,chat
where is loxahatchee fl at,chat
what is the format of the canadian citizenship test,chat
what is chicken chow mein,chat
What is up with Kent Hovind,chat
what is the oath of allegiance of the united states,chat
what is that dot on the forehead of indian women\,chat
where is good morning america studio,chat
what is primary medicine,chat
what is primary medicine,chat
where is Desmanthus Illinoensis found,chat
when was the first super bowl,chat
what is the origin of fiona,chat
what is the official language of america?,chat
what is auto quarter panel,chat
"where is shropshire, uk",chat
when was pearl harbor bombed,chat
what is the la tour de france,chat
what is the social norm approach?,chat
what is associates arts degree,chat
what is vat tax?,chat
what is high sticking in hockey,chat
what is an sd memory card reader,chat
"What was Captain Ahab's Ship in the novel ""Moby Dick""",chat
when was the trogan war,chat
where is the palatine canal,chat
what is the lowest temperature ever recorded in antarctica,chat
what is oregon institute of technology like,chat
When Is Passover Over,chat
when is halley's comet next,chat
what is soy made from,chat
what is linkedin used for,chat
"WHERE IS ROUGH AND READY, CA",chat
"WHERE IS ROUGH AND READY, CA",chat
where is rashard lewis from???,chat
what is doxycycline hyclate used for,chat
what is sodium hypochlorite solution,chat
what is sodium hypochlorite solution,chat
what is captcha code,chat
when was jacques cousteau born,chat
where was the fugitive slave law made,chat
who is in the group trinity 5 7,chat
what is eic earned income credit,chat
when is international men's day,chat
where is valley village ca,chat
What is sign of cancer,chat
when was the patriot act enacted,chat
when was the tacoma bridge collapse?,chat
what is brown flax,chat
what is a gsm cell phone,chat
what was the cash and carry lend lease,chat
what was the cash and carry lend lease,chat
what is el morro in puerto rico,chat
where are poison dart frog seen,chat
where were the Winter Olympics in 2006,chat
when was the lady gaga judas song released,chat
when was the lady gaga judas song released,chat
what is mpeg4  avc or sp/asp,chat
WHAT IS NON BINDING?,chat
who was mr big on sex and the city,chat
what is the actresses name that played in walk that line?,chat
what is the definition of a map,chat
where is university of nelson mandela metropolitan located,chat
when was How the west was won filmed?,chat
